{
  "catalogInfo": {
    "title": "Flyberry Retail Catalogue",
    "source": "RETAIL CATALOGUE_11zon.pdf",
    "pages": 15,
    "extractionDate": "2025-10-23",
    "totalCategories": 9,
    "totalSKUs": 55,
    "priceRange": {
      "min": 49,
      "max": 3960,
      "currency": "INR"
    }
  },
  "categories": [
    {
      "categoryId": "CAT-01",
      "name": "Flyberry Dates",
      "totalVarieties": 8,
      "totalSKUs": 36,
      "priceRange": "₹249 - ₹3,960",
      "products": [
        {
          "productId": "DATE-001",
          "name": "Medjoul Jumbo",
          "description": "Premium flagship date variety",
          "packaging": "Deep purple box with 'Wanna Date?' tagline",
          "skus": [
            {"size": "400g", "mrp": 1299, "pricePerUnit": 324.75},
            {"size": "500g", "mrp": 1499, "pricePerUnit": 299.80},
            {"size": "800g", "mrp": 2499, "pricePerUnit": 312.38},
            {"size": "1000g", "mrp": 2899, "pricePerUnit": 289.90}
          ]
        },
        {
          "productId": "DATE-002",
          "name": "Medjoul Large",
          "description": "Mid-size Medjoul offering",
          "packaging": "Purple box with playful branding",
          "skus": [
            {"size": "400g", "mrp": 1099, "pricePerUnit": 274.75},
            {"size": "500g", "mrp": 1299, "pricePerUnit": 259.80},
            {"size": "1000g", "mrp": 2399, "pricePerUnit": 239.90}
          ]
        },
        {
          "productId": "DATE-003",
          "name": "Mini Medjoul",
          "description": "Entry-level Medjoul pricing",
          "packaging": "Purple box, smaller format",
          "skus": [
            {"size": "125g", "mrp": 299, "pricePerUnit": 239.20},
            {"size": "200g", "mrp": 499, "pricePerUnit": 249.50},
            {"size": "500g", "mrp": 999, "pricePerUnit": 199.80},
            {"size": "1000g", "mrp": 1999, "pricePerUnit": 199.90}
          ]
        },
        {
          "productId": "DATE-004",
          "name": "Medjoul Super Jumbo",
          "description": "Ultra-premium offering",
          "packaging": "Wanna Date? branding (heart-shaped design)",
          "note": "HIGHEST PRICED retail SKU",
          "flagship": true,
          "skus": [
            {"size": "1000g Pack of 40", "mrp": 3960, "pricePerUnit": 396.00}
          ]
        },
        {
          "productId": "DATE-005",
          "name": "Ajwa Dates",
          "description": "Premium Saudi variety",
          "packaging": "Teal/cyan box with origin map storytelling",
          "origin": "Saudi Arabia",
          "skus": [
            {"size": "200g", "mrp": 599, "pricePerUnit": 299.50},
            {"size": "400g", "mrp": 1199, "pricePerUnit": 299.75},
            {"size": "800g", "mrp": 1999, "pricePerUnit": 249.88}
          ]
        },
        {
          "productId": "DATE-006",
          "name": "Ameri Dates",
          "description": "Value-premium balance",
          "packaging": "Orange box with origin map",
          "origin": "Jordan",
          "skus": [
            {"size": "200g", "mrp": 399, "pricePerUnit": 199.50},
            {"size": "400g", "mrp": 799, "pricePerUnit": 199.75},
            {"size": "500g", "mrp": 1599, "pricePerUnit": 319.80},
            {"size": "800g", "mrp": 1599, "pricePerUnit": 199.88},
            {"size": "1000g", "mrp": 1799, "pricePerUnit": 179.90}
          ]
        },
        {
          "productId": "DATE-007",
          "name": "Deglet Nour",
          "description": "Light & sweet variety",
          "packaging": "Teal box with Tunisia origin map",
          "origin": "Tunisia",
          "skus": [
            {"size": "200g", "mrp": 399, "pricePerUnit": 199.50},
            {"size": "400g", "mrp": 699, "pricePerUnit": 174.75},
            {"size": "500g", "mrp": 799, "pricePerUnit": 159.80},
            {"size": "800g", "mrp": 1299, "pricePerUnit": 162.38},
            {"size": "1000g", "mrp": 1499, "pricePerUnit": 149.90}
          ]
        },
        {
          "productId": "DATE-008A",
          "name": "Deri Dates (Regular)",
          "description": "Value date variety",
          "packaging": "Teal box",
          "skus": [
            {"size": "200g", "mrp": 249, "pricePerUnit": 124.50},
            {"size": "400g", "mrp": 899, "pricePerUnit": 224.75},
            {"size": "1000g", "mrp": 999, "pricePerUnit": 99.90}
          ]
        },
        {
          "productId": "DATE-008B",
          "name": "Deri Dates (Ambient Box)",
          "description": "Ambient storage option",
          "packaging": "Teal box, ambient storage",
          "skus": [
            {"size": "250g", "mrp": 300, "pricePerUnit": 120.00},
            {"size": "500g", "mrp": 600, "pricePerUnit": 120.00}
          ]
        },
        {
          "productId": "DATE-009",
          "name": "Halawi Dates",
          "description": "Soft & caramel-like",
          "packaging": "Peach/salmon colored box",
          "skus": [
            {"size": "200g", "mrp": 299, "pricePerUnit": 149.50},
            {"size": "400g", "mrp": 899, "pricePerUnit": 224.75},
            {"size": "500g", "mrp": 999, "pricePerUnit": 199.80}
          ]
        },
        {
          "productId": "DATE-010",
          "name": "Kalmi Dates",
          "description": "Traditional variety",
          "packaging": "Yellow/gold box",
          "skus": [
            {"size": "200g", "mrp": 399, "pricePerUnit": 199.50},
            {"size": "400g", "mrp": 1299, "pricePerUnit": 324.75}
          ]
        },
        {
          "productId": "DATE-011",
          "name": "Seedless Omani (Ambient Box)",
          "description": "Convenience offering",
          "packaging": "Pink/magenta box with seedless callout",
          "origin": "Oman",
          "skus": [
            {"size": "250g", "mrp": 400, "pricePerUnit": 160.00},
            {"size": "500g", "mrp": 800, "pricePerUnit": 160.00}
          ]
        },
        {
          "productId": "DATE-012",
          "name": "Mabroom Dates",
          "description": "Premium Saudi variety",
          "packaging": "Pink/magenta box with Saudi origin",
          "origin": "Saudi Arabia",
          "skus": [
            {"size": "200g", "mrp": 699, "pricePerUnit": 349.50},
            {"size": "400g", "mrp": 1299, "pricePerUnit": 324.75},
            {"size": "800g", "mrp": 1899, "pricePerUnit": 237.38}
          ]
        }
      ]
    },
    {
      "categoryId": "CAT-02",
      "name": "Healthy Snacks",
      "products": [
        {
          "productId": "SNACK-001",
          "name": "Date Bites",
          "description": "Medjoul Date Bites - Hero Product",
          "packaging": "Purple pouch with pink Flyberry logo",
          "heroProduct": true,
          "successMetric": "1 tonne sold in Q1 FY26 (90 days)",
          "variants": ["Mocamaze", "Matcha Madness", "Choconut", "Newberry", "Cocogo"],
          "skus": [
            {"size": "160g", "mrp": 399, "pricePerUnit": 249.38}
          ]
        },
        {
          "productId": "SNACK-002",
          "name": "Trail Mix",
          "description": "Mixed nuts and dried fruits",
          "packaging": "Blue pouch with ingredient illustration",
          "note": "Lowest price point in catalog - ₹49 entry",
          "skus": [
            {"size": "25g", "mrp": 49, "pricePerUnit": 196.00},
            {"size": "200g", "mrp": 399, "pricePerUnit": 199.50},
            {"size": "1000g", "mrp": 1999, "pricePerUnit": 199.90}
          ]
        }
      ]
    },
    {
      "categoryId": "CAT-03",
      "name": "Date Line (Value-Added Products)",
      "products": [
        {
          "productId": "DATELINE-001",
          "name": "Hazelnut Chocolate Spread",
          "description": "Date-based chocolate spread (healthier Nutella alternative)",
          "packaging": "Glass jar with pink SPREAD label",
          "skus": [
            {"size": "100g", "mrp": 299, "pricePerUnit": 299.00},
            {"size": "200g", "mrp": 499, "pricePerUnit": 249.50},
            {"size": "250g", "mrp": 629, "pricePerUnit": 251.60},
            {"size": "500g", "mrp": 1249, "pricePerUnit": 249.80}
          ]
        },
        {
          "productId": "DATELINE-002",
          "name": "Date Powder",
          "description": "Natural sweetener for baking and smoothies",
          "packaging": "Glass jar with blue label",
          "useCase": "Natural sweetener, baking, smoothies",
          "skus": [
            {"size": "50g", "mrp": 99, "pricePerUnit": 198.00},
            {"size": "180g", "mrp": 399, "pricePerUnit": 221.67},
            {"size": "300g", "mrp": 599, "pricePerUnit": 199.67}
          ]
        },
        {
          "productId": "DATELINE-003",
          "name": "Date Syrup",
          "description": "Liquid sweetener for pancakes and cocktails",
          "packaging": "Glass bottle with dropper, orange label",
          "useCase": "Liquid sweetener, pancakes, cocktails",
          "skus": [
            {"size": "100g", "mrp": 199, "pricePerUnit": 199.00},
            {"size": "325g", "mrp": 599, "pricePerUnit": 184.31},
            {"size": "700g", "mrp": 1199, "pricePerUnit": 171.29}
          ]
        }
      ]
    },
    {
      "categoryId": "CAT-04",
      "name": "Exotic Nuts",
      "products": [
        {
          "productId": "NUT-001",
          "name": "Hazelnuts",
          "description": "Premium hazelnuts",
          "packaging": "Teal pouch with Better with Fiber! callout",
          "skus": [
            {"size": "50g", "mrp": 199, "pricePerUnit": 398.00},
            {"size": "100g", "mrp": 349, "pricePerUnit": 349.00},
            {"size": "250g", "mrp": 749, "pricePerUnit": 299.60}
          ]
        },
        {
          "productId": "NUT-002",
          "name": "Macadamia Nuts",
          "description": "Ultra-premium Australian macadamia",
          "packaging": "Yellow pouch with Australia origin map",
          "origin": "Australia",